{
  "schemaVersion": 1,
  "slug": "bautizo-genesis-sarahi",
  "theme": "celeste",
  "event": {
    "type": "event",
    "subtype": "baptism",
    "names": "Génesis Sarahí",
    "tagline": "Mi bautizo y cumpleaños",
    "date": {
      "iso": "2026-10-10T14:00:00-05:00",
      "timeZone": "America/Matamoros",
      "display": "10 · Octubre · 2026",
      "timeDisplay": "2:00 PM"
    },
    "venue": {
      "name": "Parroquia San Martin De Porres",
      "address": "Heroes de la Reforma 104, Lic Benito Juárez, 88790 Reynosa, Tamps.",
      "mapsUrl": "https://maps.app.goo.gl/1anRQxP62hfExGSz7"
    }
  },
  "sections": {
    "message": {
      "enabled": true,
      "title": "Con la bendición de Dios y de mi familia",
      "body": "Con mucha alegría queremos invitarte a celebrar el bautizo y cumpleaños de Génesis Sarahí. Acompáñanos en la ceremonia religiosa y después comparte con nosotros este momento tan especial en Quinta Roma."
    },
    "people": {
      "enabled": true,
      "title": "Con la bendición de",
      "intro": "Mis padres y mis padrinos",
      "groups": [
        {
          "label": "Mis padres",
          "people": [
            {
              "name": "Xochitl Hernández"
            },
            {
              "name": "Octavio Martínez"
            }
          ]
        },
        {
          "label": "Mis padrinos",
          "people": [
            {
              "name": "Wendy Hernández"
            },
            {
              "name": "Erick Santiago"
            }
          ]
        }
      ]
    },
    "countdown": {
      "enabled": true
    },
    "details": {
      "enabled": true,
      "locations": [
        {
          "kind": "ceremony",
          "label": "Ceremonia religiosa",
          "name": "Parroquia San Martin De Porres",
          "dateDisplay": "10 · Octubre · 2026",
          "timeDisplay": "2:00 PM",
          "address": "Heroes de la Reforma 104, Lic Benito Juárez, 88790 Reynosa, Tamps.",
          "mapsUrl": "https://maps.app.goo.gl/1anRQxP62hfExGSz7"
        },
        {
          "kind": "reception",
          "label": "Recepción",
          "name": "Quinta Roma",
          "dateDisplay": "10 · Octubre · 2026",
          "timeDisplay": "5:00 PM",
          "address": "Gasoducto 340, Roma, 88755 Reynosa, Tamps.",
          "mapsUrl": "https://maps.app.goo.gl/Drb6rweZ7B7kX62j8"
        }
      ]
    },
    "schedule": {
      "enabled": false
    },
    "story": {
      "enabled": false
    },
    "gallery": {
      "enabled": false
    },
    "dressCode": {
      "enabled": false
    },
    "gifts": {
      "enabled": false
    },
    "rsvp": {
      "enabled": false
    },
    "music": {
      "enabled": false
    }
  },
  "media": {},
  "branding": {
    "footerText": "Diseñado por Your Digital Event",
    "header": {
      "enabled": false
    },
    "footer": {
      "enabled": true,
      "label": "Diseñado por",
      "name": "Your Digital Event",
      "url": "https://www.your-digital-event.com/",
      "openInNewTab": true
    },
    "palette": {
      "canvas": "#FBF8EE",
      "paper": "#FFFEF9",
      "surface": "#FFFFFF",
      "accent": "#F6EDB3",
      "accentSoft": "#F9F3CF",
      "petal": "#F7F1D7",
      "botanical": "#DFE7D8",
      "line": "#E8D990",
      "angelLeft": "#9FAF93",
      "angelRight": "#C4AF62",
      "daisyLeft": "#D8C765",
      "daisyRight": "#C9BE82",
      "ink": "#34302D",
      "muted": "#69645D",
      "focus": "#8B7A35",
      "navAccent": "#D8C765",
      "softLine": "#E8D990",
      "dot": "#B5A34E",
      "action": "#D8C765",
      "actionHover": "#C6B654",
      "actionText": "#34302D",
      "heroStart": "#FFFEF9",
      "heroEnd": "#FBF8EE",
      "gateStart": "#F9F3CF",
      "gateEnd": "#FFFEF9",
      "botanicalLine": "#A8B59D",
      "heroBotanicalLine": "#A8B59D"
    }
  }
}
